Brand & Name,Price,Url
Diesel                             Diesel Axial Round Digital Multicolor Dial Unisex Smartwach,"25,995",https://www.helioswatchstore.com/sites/default/files/DZT2022_1_0.jpg
Fossil Q                             Garrett  Round Digital Multicolor Dial Unisex Smartwach,"22,995",https://www.helioswatchstore.com/sites/default/files/FTW4041_1_0.jpg
Emporio Armani                             Buy Emporio Armani Gen 5 Round Digital Multi Color Dial Mens Watch - ART5021 | Helios Watch Store,"27,995",https://www.helioswatchstore.com/sites/default/files/ART5021_1_1.jpg
Fossil Q                             Sport Round Digital Black Dial Ladies Smartwatch,"17,995",https://www.helioswatchstore.com/sites/default/files/FTW6027_1_1.jpg
Fossil Q                             Collider Round Hybrid Black Dial Unisex Smartwach,"14,995",https://www.helioswatchstore.com/sites/default/files/FTW7007_1_0.jpg
Emporio Armani                             Matteo Round Digital Multicolor Dial Unisex Smartwach,"27,995",https://www.helioswatchstore.com/sites/default/files/ART5026_1_0.jpg
Michael Kors                             Round Digital Multi-Color Dial  Womens Watch,"25,995",https://www.helioswatchstore.com/sites/default/files/MKT5086_1_1.jpg
Mobvoi                             Ticwatch C2   Black Dial Mens Smartwatch,"19,999",https://www.helioswatchstore.com/sites/default/files/WF12036-BK_0.jpg
Fossil Q                             Garrett  Round Digital Multicolor Dial Unisex Smartwach,"22,995",https://www.helioswatchstore.com/sites/default/files/FTW4038_1_0.jpg
Emporio Armani                             Matteo Round Digital Multicolor Dial Unisex Smartwach,"27,995",https://www.helioswatchstore.com/sites/default/files/ART5027_1_0.jpg
Diesel                             Fadelite Round Digital Multicolor Dial Unisex Smartwach,"21,995",https://www.helioswatchstore.com/sites/default/files/DZT2018_1_0.jpg
Fossil Q                             Sport Round Digital Black Dial Ladies Smartwatch,"17,995",https://www.helioswatchstore.com/sites/default/files/FTW6025_1_1.jpg
Michael Kors                             Round Digital Multi-Color Dial  Womens Watch,"25,995",https://www.helioswatchstore.com/sites/default/files/MKT5087_1_1.jpg
Fitbit                             Charge 3 With Lavender Woven Rubber Strap Unisex Smartwatch,"15,999",https://www.helioswatchstore.com/sites/default/files/FB410RGLV_1_0.jpg
Emporio Armani                             Buy Emporio Armani Gen 5 Round Digital Multi Color Dial Mens Watch - ART5023 | Helios Watch Store,"27,995",https://www.helioswatchstore.com/sites/default/files/ART5023_1_1.jpg
Fossil Q                             Gen 4 Venture HR Round Digital Black Dial Ladies Smartwatch,"21,995",https://www.helioswatchstore.com/sites/default/files/FTW6015_1_1.jpg
Armani Exchange                             Buy Armani Exchange Round Analog Digital Multi Color Dial Mens Watch - AXT2002 | Helios Watch Store,"22,495",https://www.helioswatchstore.com/sites/default/files/AXT2002_1_1.jpg
Skagen                             Falster Round Digital Multicolor Dial Unisex Smartwach,"21,995",https://www.helioswatchstore.com/sites/default/files/SKT5201_1_0.jpg
Fossil Q                             FB-01 Round Hybrid Black Dial Unisex Smartwach,"11,995",https://www.helioswatchstore.com/sites/default/files/FTW1302_1_0.jpg
Fossil Q                             FB-01 Round Hybrid Blue Dial Unisex Smartwach ,"13,495",https://www.helioswatchstore.com/sites/default/files/FTW1198_1_0.jpg
Fossil Q                             FB-01 Round Hybrid Blue Dial Unisex Smartwach ,"11,995",https://www.helioswatchstore.com/sites/default/files/FTW5066_1_0.jpg
Fossil Q                             Sadie Round Hybrid White Dial Unisex Smartwach,"13,495",https://www.helioswatchstore.com/sites/default/files/FTW5073_1_0.jpg
Fossil Q                             Julianna Round Digital Multicolor Dial Unisex Smartwach,"22,995",https://www.helioswatchstore.com/sites/default/files/FTW6061_1_0.jpg
Fossil Q                             Gen 5 Round Digital Multi Colored Dial Unisex Smartwatch,"22,995",https://www.helioswatchstore.com/sites/default/files/FTW6035_1_0.jpg
Michael Kors                             Access Runway Round Digital Black Dial Ladies Smartwatch,"25,995",https://www.helioswatchstore.com/sites/default/files/MKT5045_1_1.jpg
"Fitbit                             Versa 2 Health And Fitness With Alexa, Mist Grey Unisex Smartwatch","20,999",https://www.helioswatchstore.com/sites/default/files/FB507GYSR_0.jpg
Fossil Q                             Gen 4 Venture HR Round Digital Black Dial Ladies Smartwatch,"21,995",https://www.helioswatchstore.com/sites/default/files/FTW6023_1_1.jpg
Fossil Q                             Charter Round Hybrid Black Dial Unisex Smartwach,"14,995",https://www.helioswatchstore.com/sites/default/files/FTW7011_1_0.jpg
Skagen                             Falster Round Digital Multicolor Dial Unisex Smartwach,"21,995",https://www.helioswatchstore.com/sites/default/files/SKT5200_1_0.jpg
Armani Exchange                             Buy Armani Exchange Round Analog Digital Multi Color Dial Mens Watch - AXT2003 | Helios Watch Store,"22,495",https://www.helioswatchstore.com/sites/default/files/AXT2003_1_1.jpg
"Fitbit                             Versa 2 Health And Fitness With Alexa,Copper Rose Unisex Smartwatch","20,999",https://www.helioswatchstore.com/sites/default/files/FB507RGPK_0.jpg
Fitbit                             Inspire HR With White Rubber Strap Unisex Smartwatch,"8,999",https://www.helioswatchstore.com/sites/default/files/FB413BKWT_1_0.jpg
